勘定科目,解説
雑収入,主たる営業活動以外の原因から生じる営業外収益のうち、金額的にも小さく、独立した勘定科目で計上するほどの必要性のない収益を処理する勘定科目です。具体的には、作業くず売却益、キャンセル料、ご祝儀受取り、消費税の精算差額、現金過不足、各種税金の還付加算金など。21 ----------------------------------------------------------------------------------------------------------------------------
貸倒引当金戻入額,前期に計上した貸倒引当金を戻し入れる処理をする勘定科目です。21
固定資産売却益,帳簿価額を上回る価格で固定資産を売却した際に生じる差益です。具体的には、車両売却益、建物売却益、備品売却益、土地売却益、機械売却益など。21 --------------------------------------------------------------------------------------------------------------------------------------------
家事消費等,商品を自宅で消費したときに処理する勘定科目です。21
手形売却損,手形割引を実施した際に差し引かれる手形の満期日までの利息相当額を処理する勘定科目です。21 ----------------------------------------------------------------------------------------------------------------------------------------------------------------------------
支払利息,借入金に対して支払われる利息を処理する勘定科目です。具体的には、金融機関からの借入金利息、他の会社からの借入金利息、社債利息など。21 --------------------------------------------------------------------------------------------------------------------------------------------
売上割引,売掛金が支払い期日前に決済されたことにより売上代金の割引を行う際に処理する勘定科目です。21 ----------------------------------------------------------------------------------------------------------------------------------------------------------------------------
雑損失,主たる営業活動以外の原因から生じる営業外費用のうち、金額的にも小さく、独立した勘定科目で計上するほどの必要性のない費用を処理する勘定科目です。具体的には、盗難による損失、現金過不足、損害賠償金など。22 ----------------------------------------------------------------------------------------------------------------------------
固定資産売却損,帳簿価額を下回る価格で固定資産を売却した際に生じる差損。具体的には、車両売却損、建物売却損、備品売却損、土地売却損、機械売却損など。22 --------------------------------------------------------------------------------------------------------------------------------------------
固定資産除却損,機械などの固定資産について、その使用の中止やスクラップしたことなどにより除却した場合の損失をいいます。22 ------------------------------------------------------------------------------------------------------------------------------------------------------------
法人税等,法人税、住民税及び事業税を処理する勘定科目です。具体的には、法人税、法人住民税（市町村民税、道府県民税）、法人事業税、追徴税額など。22 --------------------------------------------------------------------------------------------------------------------------------------------
事業主貸,個人支出と区別するため、および他の所得と区別するために使う勘定科目です。22
事業主借,個人支出と区別するため、および他の所得と区別するために使う勘定科目です。22
